[
  {
    "name": "Clockwork Ember Guard",
    "size": "Medium",
    "creature_type": "construct",
    "alignment": "unaligned",
    "challenge_rating": "2",
    "armor_class": 15,
    "hit_points": 45,
    "tags": ["synthetic", "fire"],
    "confidence": 1,
    "provenance": {
      "source_id": "synthetic-fixture",
      "source_title": "Synthetic Fixtures",
      "page_start": 1,
      "page_end": 1,
      "extraction_method": "manual_fixture",
      "parser_version": "fixture-v0"
    },
    "raw_json": {}
  }
]
